Textbook,Chapter Number,Chapter Title,Category,Scenario Instances,Target Audience,Chapter Summary
Internet of Things with Python,3,Interacting with Digital Outputs with Python,Scenario,Data and Processing,DevOps,test 117
Internet of Things with Python,4,Working with a RESTful API and Pulse,Scenario,Data and Processing,DevOps,test 118
Internet of Things with Python,7,Retrieving Data form the Real World with Sensors,Scenario,Others/Generic,DevOps,test 119
Internet of Things with Python,9,Working with the Cloud,Scenario,GUI,DevOps,test 120
Internet of Things with Python,10,Analyzing Huge Amounts Data with Cloud-based IoT Analytics,Scenario,Data and Processing,DevOps,test 121
Introducing Python,5,"Py Boxes: Modules, Packages, and Programs",Scenario,Others/Generic,Generic,test 122
Introducing Python,7,Mangle Data Like a Pro,Scenario,Data and Processing,Generic,test 123
Introducing Python,8,Data Has to Go Somewhere,Scenario,Others/Generic,Generic,test 124
Introducing Python,9,"The Web, Untangled",Scenario,Data and Processing,Generic,test 125
Introducing Python,11,Concurrency and Networks,Scenario,Others/Generic,Generic,test 126
Introduction to Computer Science Using Python,7,Modular Design,Scenario,GUI,Educational purposes,test 127
IPython Notebook Essentials,3,Graphics with matplotlib,Scenario,Data and Processing,Educational purposes,test 128
IPython Notebook Essentials,4,Handling Data with pandas,Scenario,Others/Generic,Educational purposes,test 129
IPython Notebook Essentials,5,"Advanced Computing with SciPy, Numba, and NumbaPro",Scenario,Data and Processing,Educational purposes,test 130
Learning Pandas,1,A Tour of pandas,Scenario,Data and Processing,Data analysis,test 131
Learning Pandas,2,Installing pandas,Scenario,Data and Processing,Data analysis,test 132
Learning Pandas,3,NumPy for pandas,Scenario,Data and Processing,Data analysis,test 133
Learning Pandas,4,The pandas Series Object,Scenario,Data and Processing,Data analysis,test 134
Learning Pandas,5,The pandas DataFrame Object,Scenario,Others/Generic,Data analysis,test 135
Learning Pandas,7,Tidying Up Your Data,Scenario,Data and Processing,Data analysis,test 136
Learning Pandas,12,Applications to Finance,Scenario,Others/Generic,Data analysis,test 137
"Learning Python, 5th Edition",24,Module Packages,Scenario,Others/Generic,Generic,test 138
"Learning Python, 5th Edition",25,Advanced Module Topics,Scenario,Others/Generic,Generic,test 139
Learning Selenium Testing Tools with Python,1,Getting Started with Selenium WebDriver and Python,Scenario,Data and Processing,Software testing,test 140
Learning Selenium Testing Tools with Python,3,Finding Elements,Scenario,Others/Generic,Software testing,test 141
Learning Selenium Testing Tools with Python,9,Advanced Techniques of Selenium WebDriver,Scenario,Data and Processing,Software testing,test 142
Lightweight Django,1,The World's Smallest Django Project,Scenario,Others/Generic,Web development,test 143
Lightweight Django,2,Stateless Web Application,Scenario,Others/Generic,Web development,test 144
Lightweight Django,3,Building a Static Site Generator,Scenario,Others/Generic,Web development,test 145
Lightweight Django,4,Building a REST API,Scenario,Others/Generic,Web development,test 146
Lightweight Django,5,Client-Side Django with Backbone.js,Scenario,Others/Generic,Web development,test 147
Lightweight Django,6,Single-Page Web Application,Scenario,API,Web development,test 148
Lightweight Django,7,Real-Time Django,Scenario,API,Web development,test 149
Lightweight Django,8,Communication Between Django and Tornado,Scenario,Others/Generic,Web development,test 150
Making Sense of NoSQL,3,NoSQL Solutions,Scenario,Others/Generic,Data analysis,test 151
Making Use of Python,6,Modules,Scenario,Others/Generic,Generic,test 152
Making Use of Python,10,CGI Programming,Scenario,Others/Generic,Generic,test 153
Making Use of Python,12,Network Programming,Scenario,Data and Processing,Generic,test 154
Making Use of Python,14,Advanced Web Programming,Scenario,Others/Generic,Generic,test 155
Making Use of Python,15,GUI Programming with Tkinter,Scenario,Others/Generic,Generic,test 156
Mastering Python,3,Containers and Collections - Stroring Data the Right Way,Scenario,GUI,Generic,test 157
Mastering Python,4,Function Programming - Readability Versus Bravity,Scenario,Others/Generic,Generic,test 158
Mastering Python,6,"Generators and Coroutines - Infinity, One Step at a Time",Scenario,Data and Processing,Generic,test 159
Mastering Python,9,Documentation - How to Use Sphinx and reStructuredText,Scenario,API,Generic,test 160
Mastering Python,13,Multiprocessing - When a Single CPU Core Is not Enough,Scenario,Others/Generic,Generic,test 161
Mastering Python,14,"Extensions in C/C++, System Calls and C/C++ Libraries",Scenario,Others/Generic,Generic,test 162
Mastering Python,15,Packaging - Creating Your Own Libraries or Applications,Scenario,Others/Generic,Generic,test 163
Mining the Social Web,2,Microformats: Semantic Markup and Common Sense Collide,Scenario,Others/Generic,Web development,test 164
Mining the Social Web,3,Mailboxs: Oldies but Goodies,Scenario,Others/Generic,Web development,test 165
Mining the Social Web,4,"Twitter: Friends, Followers, and Setwise Operations",Scenario,GUI,Web development,test 166
Mining the Social Web,5,"Twitter: The Tweet, the Whole Tweet, and Nothing but the Tweet",Scenario,Data and Processing,Web development,test 167
Mining the Social Web,6,LinkedIn: Clustering Your Professional Network for Fun (and Profit?),Scenario,Others/Generic,Web development,test 168
Mining the Social Web,7,"Google Buzz: TF-IDF, Cosine Similarity, and Collocations",Scenario,Others/Generic,Web development,test 169
Mining the Social Web,8,Blogs et al.: Natural Language Processing (and Beyond),Scenario,Others/Generic,Web development,test 170
Mining the Social Web,9,Facebook: The All-in-One Wonder,Scenario,API,Web development,test 171
Mining the Social Web,10,The Semantic Web: A Cocktail Descussion,Scenario,Others/Generic,Web development,test 172
"Mining the Social Web, 2nd Edition",1,"Mining Twitter: Exploring Treading Topics, Discovering What People Are Talking About and More",Scenario,Others/Generic,Web development,test 173
"Mining the Social Web, 2nd Edition",2,"Mining Facebook: Analyzing Fan Pages, Examming Friendships, and More",Scenario,Others/Generic,Web development,test 174
"Mining the Social Web, 2nd Edition",4,"Mining Google+: Computing Document Similarity, Extracting Collocations and More",Scenario,GUI,Web development,test 175
"Mining the Social Web, 2nd Edition",5,"Mining Web Page: Using Natural Language Processing to Understand Human Language, Summarize Blog Posts, and More",Scenario,Others/Generic,Web development,test 176
"Mining the Social Web, 2nd Edition",6,"Mining Mailboxes: Analyzing Who's Talking to Whom About What, How Often, and More",Scenario,Others/Generic,Web development,test 177
"Mining the Social Web, 2nd Edition",7,"Mining the Semantically Marked-Up Web: Extracing Microformats, Inferancing over RDF, and More",Scenario,Data and Processing,Web development,test 178
"Mining the Social Web, 2nd Edition",8,Twitter Cookbook,Scenario,Others/Generic,Web development,test 179
Numerical Python,4,Plotting and Visualization,Scenario,Data and Processing,Educational purposes,test 180
Numerical Python,9,Ordinary Differential Equations,Scenario,GUI,Educational purposes,test 181
Numerical Python,12,Data Processing and Analysis,Scenario,API,Educational purposes,test 182
Numerical Python,14,Statistical modeling,Scenario,Others/Generic,Educational purposes,test 183
Numerical Python,15,Machine Learning,Scenario,GUI,Educational purposes,test 184
Numerical Python,17,Signal Processing,Scenario,GUI,Educational purposes,test 185
NumPy Cookbook,1,Winding Along with Ipython,Scenario,Data and Processing,Educational purposes,test 186
NumPy Cookbook,3,Getting to Grips with Commonly Used Functions,Scenario,Data and Processing,Educational purposes,test 187
NumPy Cookbook,4,Connecting NumPy with the Rest of the World,Scenario,Data and Processing,Educational purposes,test 188
NumPy Cookbook,5,Audio and Image Processing,Scenario,Others/Generic,Educational purposes,test 189
NumPy Cookbook,9,Speeding Up Code with Cython,Scenario,Others/Generic,Educational purposes,test 190
"NumPy Cookbook, 2nd Edition",1,Winding Along with Ipython,Scenario,API,Educational purposes,test 191
"NumPy Cookbook, 2nd Edition",3,Getting to Grips with Commonly Used Functions,Scenario,Others/Generic,Educational purposes,test 192
"NumPy Cookbook, 2nd Edition",4,Connecting NumPy with the Rest of the World,Scenario,GUI,Educational purposes,test 193
"NumPy Cookbook, 2nd Edition",5,Audio and Image Processing,Scenario,GUI,Educational purposes,test 194
"NumPy Cookbook, 2nd Edition",9,Speeding Up Code with Cython,Scenario,Others/Generic,Educational purposes,test 195
"NumPy Cookbook, 2nd Edition",10,Fun with Scikits,Scenario,Data and Processing,Educational purposes,test 196
"NumPy Cookbook, 2nd Edition",11,Lastest and Greatest Numpy,Scenario,Others/Generic,Educational purposes,test 197
"NumPy Cookbook, 2nd Edition",12,Exploratory and Predictive Data Analysis with NumPy,Scenario,Others/Generic,Educational purposes,test 198
"Pro Django, 2nd Edition",1,Understanding Django,Scenario,Others/Generic,Web development,test 199
"Pro Django, 2nd Edition",2,Django Is Python,Scenario,Others/Generic,Web development,test 200
"Pro Django, 2nd Edition",4,URLs and Views,Scenario,GUI,Web development,test 201
"Pro Django, 2nd Edition",5,Forms,Scenario,Data and Processing,Web development,test 202
"Pro Django, 2nd Edition",6,Templates,Scenario,GUI,Web development,test 203
"Pro Django, 2nd Edition",7,Handling HTTP,Scenario,GUI,Web development,test 204
"Pro Django, 2nd Edition",8,Backend Protocols,Scenario,Others/Generic,Web development,test 205
"Pro Django, 2nd Edition",11,Enhancing Applications,Scenario,Others/Generic,Web development,test 206
Pro IronPython,2,IronPython Syntax,Scenario,Others/Generic,Generic,test 207
Pro IronPython,3,Advanced IronPython,Scenario,Others/Generic,Generic,test 208
Pro IronPython,4,IronPython Studio,Scenario,Others/Generic,Generic,test 209
Pro IronPython,5,Mixing and Mingling with CLR,Scenario,Data and Processing,Generic,test 210
Pro IronPython,8,Caught in a Web,Scenario,Others/Generic,Generic,test 211
Pro IronPython,9,IronPython Recipes,Scenario,API,Generic,test 212
"Pro Python, 2nd Edition",11,Sheets: A CSV Framework,Scenario,Others/Generic,Generic,test 213
Professional Python,12,Cli Tools,Scenario,API,Generic,test 214
Professional Python,13,Asyncio,Scenario,Data and Processing,Generic,test 215
Python 3 for Absolute Beginners,7,Working with Text,Scenario,API,Generic,test 216
Python 3 for Absolute Beginners,8,"Executable Files, Organization, and Python on the Web",Scenario,Data and Processing,Generic,test 217
Python 3 for Absolute Beginners,12,Simple Windowed Applications,Scenario,Data and Processing,Generic,test 218
"Python 3 Patterns, Recipes and Idioms",2,Taching Support,Scenario,Data and Processing,Educational purposes,test 219
"Python 3 Patterns, Recipes and Idioms",3,Book Development Rules,Scenario,GUI,Educational purposes,test 220
"Python 3 Patterns, Recipes and Idioms",6,Python for Programmers,Scenario,GUI,Educational purposes,test 221
"Python 3 Patterns, Recipes and Idioms",12,"Generators, Iterators, and Itertools",Scenario,Others/Generic,Educational purposes,test 222
"Python 3 Patterns, Recipes and Idioms",14,"Coroutines, Concurrency & Distributed Systems",Scenario,GUI,Educational purposes,test 223
"Python 3 Patterns, Recipes and Idioms",15,Jython,Scenario,Others/Generic,Educational purposes,test 224
"Python 3 Patterns, Recipes and Idioms",19,Messanger/Data Transfer Object,Scenario,API,Educational purposes,test 225
"Python 3 Patterns, Recipes and Idioms",23,Building Application Frameworks,Scenario,API,Educational purposes,test 226
"Python 3 Patterns, Recipes and Idioms",24,Fronting for an Implementation,Scenario,GUI,Educational purposes,test 227
"Python 3 Patterns, Recipes and Idioms",26,Decorator: Dynamic Type Selection,Scenario,Others/Generic,Educational purposes,test 228
"Python 3 Patterns, Recipes and Idioms",28,Factory: Encapsulating Object Creation,Scenario,Data and Processing,Educational purposes,test 229
"Python 3 Patterns, Recipes and Idioms",30,Changing the Interface,Scenario,GUI,Educational purposes,test 230
"Python 3 Patterns, Recipes and Idioms",36,Projects,Scenario,Others/Generic,Educational purposes,test 231
Python Algorithms,3,Counting 101,Scenario,Data and Processing,Educational purposes,test 232
Python Algorithms,5,Traversal: The Skeleton Key og Algorithmics,Scenario,Others/Generic,Educational purposes,test 233
Python Algorithms,6,"Divide, Combine, and Conquer",Scenario,GUI,Educational purposes,test 234
Python Algorithms,8,Tangled Dependencies and Memoization,Scenario,Others/Generic,Educational purposes,test 235
"Python Algorithms, 2nd Edition",1,Introduction,Scenario,API,Educational purposes,test 236
"Python Algorithms, 2nd Edition",3,Counting 101,Scenario,Others/Generic,Educational purposes,test 237
"Python Algorithms, 2nd Edition",5,Traversal: The Skeleton Key og Algorithmics,Scenario,Others/Generic,Educational purposes,test 238
"Python Algorithms, 2nd Edition",6,"Divide, Combine, and Conquer",Scenario,API,Educational purposes,test 239
"Python Algorithms, 2nd Edition",8,Tangled Dependencies and Memoization,Scenario,Data and Processing,Educational purposes,test 240
"Python Cookbook, 2nd Edition",4,Python Shortcuts,Scenario,API,Generic,test 241
"Python Cookbook, 2nd Edition",10,System Administration,Scenario,API,Generic,test 242
"Python Cookbook, 2nd Edition",11,User Interfaces,Scenario,API,Generic,test 243
"Python Cookbook, 2nd Edition",12,Processing XML,Scenario,API,Generic,test 244
"Python Cookbook, 2nd Edition",13,Network Programming,Scenario,API,Generic,test 245
"Python Cookbook, 2nd Edition",14,Web Programming,Scenario,API,Generic,test 246
"Python Cookbook, 2nd Edition",16,Programs About Programs,Scenario,API,Generic,test 247
"Python Cookbook, 2nd Edition",17,Extending and Embedding,Scenario,GUI,Generic,test 248
Python Crash Course,15,Generating Data,Scenario,GUI,Generic,test 249
Python Crash Course,16,Downloading Data,Scenario,GUI,Generic,test 250
Python Crash Course,17,Working with APIs,Scenario,GUI,Generic,test 251
Python Crash Course,18,Getting Started with Django,Scenario,GUI,Generic,test 252
Python Crash Course,19,User Accounts,Scenario,API,Generic,test 253
Python Crash Course,20,Styling and Developing an App,Scenario,API,Generic,test 254
Python Data Analysis,1,Getting Started with Python Libraries,Scenario,Data and Processing,Data analysis,test 255
Python Data Analysis,2,NumPy Arrays,Scenario,Data and Processing,Data analysis,test 256
Python Data Analysis,4,Pandas Primer,Scenario,Data and Processing,Data analysis,test 257
Python Data Analysis,6,Data Visualization,Scenario,API,Data analysis,test 258
Python Data Analysis,7,Signal Processing and Time Series,Scenario,API,Data analysis,test 259
Python Data Analysis,8,Working with Databases,Scenario,API,Data analysis,test 260
Python Data Analysis,9,Analyzing Textual Data and Social Media,Scenario,GUI,Data analysis,test 261
Python Data Analysis,10,Predictive Analytics and Machine Learning,Scenario,Others/Generic,Data analysis,test 262
Python Data Analysis,11,Environments Outside the Python Ecosystem and Cloud Computing,Scenario,Others/Generic,Data analysis,test 263
Python Data Analysis,12,"Performance Tuning, Profilling, and Concurrency",Scenario,Others/Generic,Data analysis,test 264
Python Data Analytics,1,An Introduction to Data Analysis,Scenario,Others/Generic,Data analysis,test 265
Python Data Analytics,3,The NumPy Library,Scenario,Data and Processing,Data analysis,test 266
Python Data Analytics,4,The pandas Library---An Introduction,Scenario,Data and Processing,Data analysis,test 267
Python Data Analytics,5,pandas: Reading and Writing Data,Scenario,Data and Processing,Data analysis,test 268
Python Data Analytics,6,pandas in Depth: Data Manipulation,Scenario,Data and Processing,Data analysis,test 269
Python Data Analytics,7,Data Visualization with matplotlib,Scenario,Data and Processing,Data analysis,test 270
Python Data Analytics,8,Machine Learning with scikit-learn,Scenario,API,Data analysis,test 271
Python Data Analytics,9,An Example---Meteorological Data,Scenario,GUI,Data analysis,test 272
Python Data Analytics,10,Embadding the Javascript D3 Library in IPython Notebook,Scenario,GUI,Data analysis,test 273
Python Data Analytics,11,Recognizing Handwritten Digits,Scenario,Data and Processing,Data analysis,test 274
Python for Data Analysis,2,Introductory Examples,Scenario,Data and Processing,Data analysis,test 275
Python for Data Analysis,4,NumPy Basics: Arrays and Vectorized Computation,Scenario,Data and Processing,Data analysis,test 276
Python for Data Analysis,8,Plotting and Visualization,Scenario,Data and Processing,Data analysis,test 277
Python for Data Analysis,11,Financial and Economic Data Applications,Scenario,Data and Processing,Data analysis,test 278
Python for Data Analysis,12,Advanced NumPy,Scenario,Others/Generic,Data analysis,test 279
Python for Google App Engine,2,A More Complex Application,Scenario,Others/Generic,Web development,test 280
Python for Google App Engine,5,Storing Data in Google Cloud SQL,Scenario,Data and Processing,Web development,test 281
Python for Google App Engine,6,Using Channels to Implement a Real-time Application,Scenario,Data and Processing,Web development,test 282
Python for Google App Engine,7,Building an Application with Django,Scenario,Others/Generic,Web development,test 283
Python for Google App Engine,8,Exposing a REST API with Google Cloud Endpoints,Scenario,API,Web development,test 284
Python for Kids,4,Drawing with Turtles,Scenario,GUI,Generic,test 285
Python for Kids,7,Recycling Your Code with Functions and Modules,Scenario,Others/Generic,Generic,test 286
Python for Kids,10,Useful Python Modules,Scenario,GUI,Generic,test 287
Python for Kids,11,More Turtle Graphics,Scenario,GUI,Generic,test 288
Python for Kids,12,Using Tkinter for Better Graphics,Scenario,GUI,Generic,test 289
Python for Kids,13,Beginning Your First Game: Bounce!,Scenario,Others/Generic,Generic,test 290
Python for Kids,14,Finishing /your First Game: Bounce!,Scenario,Others/Generic,Generic,test 291
Python for Kids,15,Creating Graphics for The Mr.Stick Man Game,Scenario,Others/Generic,Generic,test 292
Python for Kids,16,Developing The Mr.Stick Man Game,Scenario,Others/Generic,Generic,test 293
Python for Kids,17,Creating Mr.Stick Man,Scenario,Others/Generic,Generic,test 294
Python for Kids,18,Completing The Mr.Stick Man Game,Scenario,Others/Generic,Generic,test 295
Python GUI Programming Cookbook,1,Creating the GUI Form and Adding Widgets,Scenario,GUI,Computer graphics,test 296
Python GUI Programming Cookbook,3,Look and Feel Customization,Scenario,Others/Generic,Computer graphics,test 297
Python GUI Programming Cookbook,5,Matplotlib Charts,Scenario,Others/Generic,Computer graphics,test 298
Python GUI Programming Cookbook,7,Storing Data in Out MySQL Database via Our GUI,Scenario,GUI,Computer graphics,test 299
Python GUI Programming Cookbook,9,Extending Our GUI with the wxPython Library,Scenario,GUI,Computer graphics,test 300
Python GUI Programming Cookbook,10,Creating Amazing 3D GUIs with PyOpenGL and PyGLet,Scenario,GUI,Computer graphics,test 301
Python in Education,2,A Pythonic Case Study: Raspberry Pi,Scenario,Others/Generic,Educational purposes,test 302
Python Machine Learning,1,Giving Computers the Ability to Learn from Data,Scenario,Others/Generic,Machine learning,test 303
Python Machine Learning,2,Training Machine Learning Algorithms of Classification,Scenario,Data and Processing,Machine learning,test 304
Python Machine Learning,3,A Tour of Machine Learning Classifiers Using Scikit-learn,Scenario,Data and Processing,Machine learning,test 305
Python Machine Learning,4,Building Good Training Sets - Data Preprocessing,Scenario,Data and Processing,Machine learning,test 306
Python Machine Learning,7,Combining Different Models for Ensemble Learning,Scenario,Data and Processing,Machine learning,test 307
Python Machine Learning,8,Applying Machine Learning to Sentiment Analysis,Scenario,Data and Processing,Machine learning,test 308
Python Machine Learning,9,Embedding a Machine Learning Model into a Web Application,Scenario,Data and Processing,Machine learning,test 309
Python Machine Learning,10,Predicting Continuous Target Variables with Regression Analysis,Scenario,Data and Processing,Machine learning,test 310
Python Machine Learning,11,Working with Unabeled Data - Clustering Analysis,Scenario,Data and Processing,Machine learning,test 311
Python Machine Learning,12,Trainging Artificial Nerual Networks for Image Recognition,Scenario,Data and Processing,Machine learning,test 312
Python Machine Learning,13,Parallelizing Neural Network Training with Theano,Scenario,Data and Processing,Machine learning,test 313
Python Parallel Programming Cookbook,6,GPU Programming with Python,Scenario,Data and Processing,Educational purposes,test 314
Python Playground,1,Parasing Itunes Playlists,Scenario,Others/Generic,Generic,test 315
Python Playground,2,Spirographs,Scenario,GUI,Generic,test 316
Python Playground,3,Conway's Game of Lift,Scenario,Others/Generic,Generic,test 317
Python Playground,5,Boids: Simulating a Flock,Scenario,Others/Generic,Generic,test 318
Python Playground,6,ASCII ART,Scenario,GUI,Generic,test 319
Python Playground,7,Photomosaics,Scenario,GUI,Generic,test 320
Python Playground,8,Autostereograms,Scenario,GUI,Generic,test 321
Python Playground,9,Understanding OpenGL,Scenario,API,Generic,test 322
Python Playground,10,Particle Systems,Scenario,GUI,Generic,test 323
Python Playground,11,Volume Rendering,Scenario,GUI,Generic,test 324
Python Playground,13,Laser Audio Display,Scenario,GUI,Generic,test 325
Python Playground,14,A Raspberry Pi-Based Weather Monitor,Scenario,Others/Generic,Generic,test 326
"Python Pocket Reference, 4th Edition",15,Standard Library Modules,Scenario,Others/Generic,Generic,test 327
"Python Pocket Reference, 4th Edition",16,The sys Module,Scenario,Others/Generic,Generic,test 328
"Python Pocket Reference, 4th Edition",17,The os System Module,Scenario,Others/Generic,Generic,test 329
"Python Pocket Reference, 4th Edition",18,The re Pattern-Matching Module,Scenario,Data and Processing,Generic,test 330
"Python Pocket Reference, 4th Edition",19,Object Persistence Modules,Scenario,Others/Generic,Generic,test 331
"Python Pocket Reference, 4th Edition",20,The tkinter GUI Module and Tools,Scenario,GUI,Generic,test 332
"Python Pocket Reference, 4th Edition",21,Internet Modules and Tools,Scenario,Others/Generic,Generic,test 333
"Python Pocket Reference, 4th Edition",22,Other Standard Library Modules,Scenario,GUI,Generic,test 334
"Python Pocket Reference, 4th Edition",23,Python Portable SQL Database API,Scenario,API,Generic,test 335
Python Projects for Kids,8,Pygame,Scenario,Data and Processing,Generic,test 336
Python Projects for Kids,9,Tiny Tennis,Scenario,Others/Generic,Generic,test 337
Python Scripting for Computational Science,5,"Combining Python with Fortran, C, and C++",Scenario,Others/Generic,Educational purposes,test 338
Python Scripting for Computational Science,7,Web Interfaces and CGI Programming,Scenario,GUI,Educational purposes,test 339
Python Scripting for Computational Science,9,Fortran Programming with NumPy Arrays,Scenario,Data and Processing,Educational purposes,test 340
Python Scripting for Computational Science,10,C and C++ Programming with NumPy Arrays,Scenario,Data and Processing,Educational purposes,test 341
Python Scripting for Computational Science,12,Tools and Examples,Scenario,Others/Generic,Educational purposes,test 342
Python Unlocked,5,Elegance with Design Patterns,Scenario,Others/Generic,Generic,test 343
Python Unlocked,8,Scalling Python,Scenario,Others/Generic,Generic,test 344
Python Web Development with Django,1,Practical Python for Django,Scenario,Data and Processing,Web development,test 345
Python Web Development with Django,2,Django for the Impatient: Building a Blog,Scenario,API,Web development,test 346
Python Web Development with Django,5,"URLs, HTTP Mechanisms, and Views URLs",Scenario,API,Web development,test 347
Python Web Development with Django,6,Templates and Form Processing Templates,Scenario,Data and Processing,Web development,test 348
Python Web Development with Django,7,Photo Gallery,Scenario,GUI,Web development,test 349
Python Web Development with Django,8,Content Management System,Scenario,Data and Processing,Web development,test 350
Python Web Development with Django,9,Liveblog,Scenario,Others/Generic,Web development,test 351
Python Web Development with Django,10,Pastebin,Scenario,Others/Generic,Web development,test 352
Python Web Development with Django,11,Advanced Django Programming,Scenario,Others/Generic,Web development,test 353
Python XML,1,Python and XML,Scenario,API,Web development,test 354
Python XML,2,XML Fundamentals,Scenario,Others/Generic,Web development,test 355
Python XML,3,The Simple API for XML,Scenario,API,Web development,test 356
Python XML,5,Querying XML with Xpath,Scenario,Data and Processing,Web development,test 357
Python XML,6,Transforming XML with XSLT,Scenario,Data and Processing,Web development,test 358
Python XML,7,XML Validation and Dialects,Scenario,Data and Processing,Web development,test 359
Python XML,8,Python Internet APIs,Scenario,API,Web development,test 360
Python XML,9,"Python, Web Services, and SOAP",Scenario,Data and Processing,Web development,test 361
Raspberry Pi Cookbook for Python Programmers,3,Using Python for Automation and Productivity,Scenario,Data and Processing,Others,test 362
Raspberry Pi Cookbook for Python Programmers,4,Creating Games and Graphics,Scenario,GUI,Others,test 363
