Textbook,Chapter Number,Chapter Title,Category,Scenario Instances,Target Audience,Chapter Summary
20 python libraries you aren't using but should,4,Easier Python Packaging with flit,Scenario,Others/Generic,Generic,"The ""Easier Python Packaging with flit"" chapter presents flit, a Python library that simplifies the process of submitting a Python package to the Python Package Index (PyPI). The traditional process of submitting a package requires creating a setup.py file which can be tedious, whereas flit can create a configuration file interactively. flit requires only minimal package information, and for straightforward packages, it is simple to upload them to PyPI. The chapter provides step-by-step instructions on how to install and use flit, as well as how to complete the additional steps necessary to submit a package to PyPI. The simplified process that flit provides helps developers to more easily package and distribute their Python projects."
20 python libraries you aren't using but should,5,Command-Line Applications,Scenario,Others/Generic,Generic,"The ""Command-Line Applications"" chapter introduces two Python libraries for creating command-line applications with improved user experience. The first library, colorama, allows for the use of colors in the command-line output, which can significantly improve the user interface. The second library, begins, simplifies the creation of command-line interfaces by providing an easy-to-use interface for specifying and processing command-line options. Begins also offers additional features such as automatic handling of environment variables, config files, error handling, and logging. However, if begins seems too advanced, there are other options available such as click."
20 python libraries you aren't using but should,6,Graphical User Interfaces,Scenario,GUI,Generic,"The ""Graphical User Interfaces"" chapter introduces the PyQt and tkinter libraries for creating graphical user interfaces (GUIs) in Python. The chapter also highlights two lesser-known libraries: pyqtgraph and pywebview. pyqtgraph is a chart-plotting library that offers different features than the more popular matplotlib library, with a focus on interactive and real-time visualization. pywebview allows for creating a browser-like interface as a desktop client interface, which is based on tools like cefpython and Electron. The chapter provides examples and code snippets to demonstrate how to use and create GUIs with these libraries, showcasing their usefulness in developing effective and interactive desktop applications."
20 python libraries you aren't using but should,8,Web APIs with hug,Scenario,API,Generic,"The ""Web APIs with hug"" chapter introduces the hug library, which simplifies the process of building web APIs. hug allows developers to create fully-functional web APIs with minimal code and configuration, making it a valuable tool for quickly building APIs. The chapter provides examples of how to use hug to define endpoints and specify input and output formats for a web API. Hug offers automatic API documentation, which makes it easy for developers to understand and use the API. The chapter also explains how to test a hug-based API and provides examples of how to test it using different tools like curl and Postman. Overall, the hug library provides a simple and efficient way to create web APIs with minimal setup or configuration."
20 python libraries you aren't using but should,9,Dates and Times,Scenario,Others/Generic,Generic,"The ""Dates and Times"" chapter introduces several libraries in Python that are designed to work with dates and times. The chapter explains how to work with Python's built-in datetime module and highlights some of its more useful and powerful features, such as time zone support. The chapter also introduces two additional libraries for working with dates and times: arrow and pendulum. Arrow is a library that provides a more human-readable format for dates and times and makes it easy to do date and time arithmetic. Pendulum is another library that offers a similar interface to arrow but with additional support for things like leap years and time zones. Finally, the chapter introduces the parsedatetime library, which is designed to help with parsing natural language input into dates and times. Throughout the chapter, various examples and code snippets are used to demonstrate how to use these different libraries effectively in various tasks."
20 python libraries you aren't using but should,10,General-Purpose Libraries,Scenario,Others/Generic,Generic,"The ""General-Purpose Libraries"" chapter introduces two Python libraries that can improve the functionality of the Python standard library: Boltons and Cython. Boltons is a collection of small libraries that provide various functionalities such as caching, templates, and differentiation, while Cython is a library that allows developers to optimize normal Python code by converting it into C code. The chapter explains the features and functions of both libraries, and gives examples of how to use them in practical scenarios. The chapter also mentions a few other libraries such as flit, colorama, and parsedatetime, among others, that provide additional functionality to Python developers. The chapter highlights the usefulness of these libraries in improving the efficiency of Python code and suggests that adding such libraries to your program can make development much more efficient."
2019 Book A Beginner's Guide To Python 3 Program,8,Number Guessing Game,Scenario,Others/Generic,Generic,"Chapter ""Number Guessing Game"" provides an introduction to creating a simple program where the user guesses a randomly generated number. The steps involved in creating the program are explained in detail, including adding welcome messages, generating the random number, obtaining user input, checking the number of guesses, notifying the player about the number of guesses, and ending the game. The chapter also includes a complete code listing and some helpful hints for initialization and blank lines. Several exercises are also included in the chapter to help with practice."
2019 Book A Beginner's Guide To Python 3 Program,16,Curried Functions,Scenario,Data and Processing,Generic,"Chapter ""Curried Functions"" provides an introduction to currying concepts and shows how to create curried functions with Python. The chapter explains how to create a Python curried function with closures and provides some examples to help readers understand this concept. It also explains how to apply currying to real-world problems. In addition, the chapter covers the definitions and concepts of higher-order functions, which are required to understand curried functions. The chapter includes a complete code listing and several exercises for readers to practice creating curried functions with Python. "
2019 Book A Beginner's Guide To Python 3 Program,25,Python Modules and Packages,Scenario,Others/Generic,Generic,"Chapter ""Python Modules and Packages"" provides a detailed look at modules and packages in Python. It explains the differences between modules and packages, how to use them, and how to create them. The chapter covers topics such as importing modules, hiding certain elements of modules, searching for and importing modules, and setting up and creating packages. The differences between built-in and external modules are also explained. Additionally, the chapter shows how to create scripts using modules, describes the concept of abstract base classes and the process of subclassing them, and introduces readers to the protocol, polymorphism, and descriptor protocols. The chapter provides examples and source code to aid in better understanding. Several exercises for readers to practice are also included at the end of the chapter."
2019 Book A Beginner's Guide To Python 3 Program,37,TicTacToe Game,Scenario,GUI,Generic,"Chapter ""TicTacToe Game"" provides a comprehensive description of creating a two-player Tic Tac Toe game using Python. The chapter covers topics such as board creation, player moves, game logic and rules, alternate player turns, winning conditions and tie conditions. It also explains the importance and benefits of using object-oriented programming (OOP) concepts in game development. The chapter includes complete source code for building the game, along with step-by-step instructions on how the different objects interact with each other. Additionally, the chapter covers various techniques for improving the game, such as adding graphics and sounds. Several exercises are included at the end of the chapter for readers to practice and enhance their skills in Python game development."
2019 Book Advanced Guide To Python3 Programm,3,Python Turtle Graphics,Scenario,GUI,Generic,"Chapter ""Python Turtle Graphics"" provides an introduction to Python's Turtle Graphics library. It explains the basics of the Turtle module and how it can be used to create simple vector graphics with x, y coordinates using commands such as forward and right. The chapter also briefly discusses other graphics libraries, such as PyOpenGL, which can be used to create more complex 3D scenes."
2019 Book Advanced Guide To Python3 Programm,4,Computer Generated Art,Scenario,GUI,Generic,"Chapter ""Computer Generated Art"" is about computer generated art, which is defined as any art that uses a computer or a computer program. The chapter gives an example of how simple Python code using the Turtle graphics library can be used to generate images that can be considered computer art. The chapter includes a recursive function that draws circles of different sizes in a location specified by x, y coordinates, creating images with fractal-like patterns. The chapter also examines various techniques for generating computer art, including creating art with mathematical functions and random numbers."
2019 Book Advanced Guide To Python3 Programm,6,Graphing with Matplotlib pyplot,Scenario,GUI,Generic,"Chapter ""Graphing with Matplotlib pyplot"" of the book introduces the Matplotlib pyplot API, which is used to generate various types of charts and graphs using Matplotlib. The chapter explains how the pyplot API simplifies plotting creation and manipulation, and it introduces high-level functions such as bar(), plot(), scatter(), and pie() for creating different types of charts. The chapter also covers how parameters can be used with pyplot functions to customize plots and provides examples of how to create a simple bar chart and a grouped bar chart. The chapter concludes by discussing figures and subplots, with examples of how to generate a figure object that can be used to add multiple subplots to a single figure."
2019 Book Advanced Guide To Python3 Programm,7,Graphical User Interfaces,Scenario,Others/Generic,Generic,"Chapter ""Graphical User Interfaces"" is about graphical user interfaces (GUIs) in general. The chapter introduces the concept of GUIs, explaining that they can provide a more intuitive and user-friendly experience compared to traditional command-line interfaces. The chapter discusses the advantages of GUIs, such as their ability to capture complex ideas in a visual format and their ease of use for non-technical users. The chapter provides an overview of the history of GUIs and their development over time, including the transition from textual displays to graphical displays. The chapter then covers the range of GUI libraries available for Python and explains how to create rich client graphical displays using these libraries. Finally, the chapter explains how to create windows, buttons, text fields, and labels, and provides examples of how to position and organize these GUI elements."
2019 Book Advanced Guide To Python3 Programm,8,The wxPython GUI Library,Scenario,GUI,Generic,"Chapter ""The wxPython GUI Library"" of the book is about the wxPython GUI library, which is a cross-platform library for creating graphical user interfaces in Python. The chapter explains that GUI elements in wxPython are contained within top-level windows, such as Frames or Dialogs, and that widgets or controls can be grouped together into containers, such as Panels. The chapter introduces the various components of wxPython and provides examples of how to create basic Frames and Dialogs, as well as Widgets/Controls such as buttons, checkboxes, and text fields. The chapter also covers more advanced topics, such as arranging Widgets within containers and drawing graphics, and it provides a SimpleGUIApplication exercise for readers to practice what they have learned."
2019 Book Advanced Guide To Python3 Programm,9,Events in wxPython User Interfaces,Scenario,Others/Generic,Generic,"Chapter ""Events in wxPython User Interfaces"" of the book is about events in wxPython user interfaces. It explains that events are actions or occurrences that can trigger a response from the application, and that events are handled by event handlers in wxPython. The chapter introduces the various types of events that can occur in a wxPython user interface, such as mouse events and keyboard events, and explains how to bind events to event handlers using the Bind() method. The chapter provides examples of how to implement event handling in wxPython, including an interactive wxPython GUI for a simple calculator. The chapter concludes with online resources and exercises for readers to practice creating event handlers in wxPython."
2019 Book Advanced Guide To Python3 Programm,10,PyDraw wxPython Example Application,Scenario,GUI,Generic,"Chapter ""PyDraw wxPython Example Application"" of the book is about the PyDraw wxPython example application. It introduces the Model-View-Controller (MVC) architecture and explains how it is used in the PyDraw application, which is a simple drawing program made with wxPython. The chapter provides a detailed explanation of how the MVC architecture is implemented in the PyDraw application, including the different classes and their relationships, such as the View class that handles drawing and the Controller class that handles user input. The chapter also covers how to use event binding in wxPython to handle user input, and it provides examples of how to add additional functionality to the PyDraw application, such as color selection and line thickness adjustment. The chapter concludes with online resources and exercises for readers to practice using the MVC architecture and event handling in wxPython."
2019 Book Advanced Guide To Python3 Programm,12,Building Games with pygame,Scenario,Data and Processing,Generic,"Chapter ""Building Games with pygame"" is about building games with Pygame, a popular library for game development in Python. The chapter provides an introduction to Pygame and covers its various modules, such as the display module for creating and managing the game window and the event module for handling user input. The chapter explains how to create a basic Pygame application, including how to set up the game window and how to use the event module to detect user input. The chapter then covers more advanced game development topics, such as animation and collision detection, and provides examples of how to create interactive games using Pygame. The chapter also covers different approaches to processing input devices and provides online resources for further learning."
2019 Book Advanced Guide To Python3 Programm,13,StarshipMeteors pygame,Scenario,Data and Processing,Generic,"Chapter ""StarshipMeteors pygame"" is about building the StarshipMeteors game using Pygame. The chapter provides a step-by-step guide on how to create a simple 2D game in Pygame, which involves controlling a spaceship and avoiding incoming meteoroids. The chapter explains how to create game objects and classes, such as the spaceship, meteoroids, and text labels, and how to display them on the game window using Pygame. The chapter covers game mechanics such as collision detection, movement and scoring through Python code and Pygame. The chapter provides online resources and exercises for readers to practice building games with Pygame."
2019 Book Advanced Guide To Python3 Programm,20,Working with CSV Files,Scenario,Data and Processing,Generic,test 20
2019 Book Advanced Guide To Python3 Programm,21,Working with Excel Files,Scenario,API,Generic,test 21
2019 Book Advanced Guide To Python3 Programm,22,Regular Expressions in Python,Scenario,Data and Processing,Generic,test 22
2019 Book Advanced Guide To Python3 Programm,24,Python DB-API,Scenario,Data and Processing,Generic,test 23
2019 Book Advanced Guide To Python3 Programm,25,PyMySQL Module,Scenario,API,Generic,test 24
2019 Book Advanced Guide To Python3 Programm,30,Threading,Scenario,Data and Processing,Generic,test 25
2019 Book Advanced Guide To Python3 Programm,31,Multiprocessing,Scenario,API,Generic,test 26
2019 Book Advanced Guide To Python3 Programm,34,Concurrency with AsyncIO,Scenario,API,Generic,test 27
2019 Book Advanced Guide To Python3 Programm,36,"RxPy Observables, Observers and Subjects",Scenario,API,Generic,test 28
2019 Book Advanced Guide To Python3 Programm,37,RxPy Operators,Scenario,API,Generic,test 29
2019 Book Advanced Guide To Python3 Programm,39,Sockets in Python,Scenario,API,Generic,test 30
2019 Book Advanced Guide To Python3 Programm,40,Web Services in Python,Scenario,Others/Generic,Generic,test 31
2019 Book Advanced Guide To Python3 Programm,41,Bookshop Web Service,Scenario,Others/Generic,Generic,test 32
A Whirlwind Tour of Python,8,Built-In Data Structures,Scenario,Data and Processing,Generic,test 33
A Whirlwind Tour of Python,15,Modules and Packages,Scenario,Others/Generic,Generic,test 34
Becoming a Better Programmer,6,Navigating a Route,Scenario,Others/Generic,Generic,test 35
Becoming a Better Programmer,17,Use Your Brain,Scenario,Others/Generic,Generic,test 36
Becoming a Better Programmer,19,A Case for Code Reuse,Scenario,Others/Generic,Generic,test 37
Beginning Django CMS,1,Working with a CMS,Scenario,Others/Generic,Web development,test 38
Beginning Django CMS,4,Site Templates,Scenario,Others/Generic,Web development,test 39
Beginning Django CMS,5,Your Blog Website: Templates,Scenario,Others/Generic,Web development,test 40
Beginning Django CMS,6,django CMS Plugins,Scenario,Others/Generic,Web development,test 41
Beginning Django CMS,7,Advanced Plugins,Scenario,API,Web development,test 42
Beginning Django CMS,8,Authoring in ajango CMS,Scenario,API,Web development,test 43
Beginning Django CMS,10,Extending django CMS,Scenario,Others/Generic,Web development,test 44
Beginning Game Development with Python and Pygame,4,Creating Visuals,Scenario,Others/Generic,Game development,test 45
Beginning Game Development with Python and Pygame,12,Setting the Scene with OpenGL,Scenario,Others/Generic,Game development,test 46
"Beginning Python Games Development, 2nd Edition",12,Setting the Scene with OpenGL,Scenario,Data and Processing,Game development,test 47
Bioinformatics with Python Cookbook,3,Working with Genomes,Scenario,Others/Generic,Educational purposes,test 48
Bioinformatics with Python Cookbook,4,Population Genetics,Scenario,Data and Processing,Educational purposes,test 49
Bioinformatics with Python Cookbook,5,Population Genetics Simulation,Scenario,Data and Processing,Educational purposes,test 50
Bioinformatics with Python Cookbook,6,Phylogenetics,Scenario,GUI,Educational purposes,test 51
Bioinformatics with Python Cookbook,7,Using the Protein Data Bank,Scenario,Others/Generic,Educational purposes,test 52
Bioinformatics with Python Cookbook,8,Other Topics in Bioinformatics,Scenario,Others/Generic,Educational purposes,test 53
Bioinformatics with Python Cookbook,9,Python for Big Genomics Datasets,Scenario,API,Educational purposes,test 54
Data Structures and Algorithms with Python,8,Membership Structures,Scenario,Data and Processing,Data analysis,test 55
Data Structures and Algorithms with Python,12,Heuristic Search,Scenario,Data and Processing,Data analysis,test 56
Data Wrangling with Python,3,Data Meant to Be Read by Machines,Scenario,API,Data analysis,test 57
Data Wrangling with Python,4,Working with Excel Files,Scenario,Others/Generic,Data analysis,test 58
Data Wrangling with Python,5,PDFs and Problem Solving in Python,Scenario,Others/Generic,Data analysis,test 59
Data Wrangling with Python,8,Data Cleanup: Standardizing and Scripting,Scenario,Others/Generic,Data analysis,test 60
Data Wrangling with Python,9,Data Exploration and Analysis,Scenario,Others/Generic,Data analysis,test 61
Data Wrangling with Python,10,Presenting Your Data,Scenario,Others/Generic,Data analysis,test 62
Data Wrangling with Python,11,Web Scraping: Acquiring and Storing Data form the Web,Scenario,Others/Generic,Data analysis,test 63
Data Wrangling with Python,12,Advance Web Scraping: Screen Scrapers and Spiders,Scenario,Others/Generic,Data analysis,test 64
Data Wrangling with Python,13,APIs,Scenario,API,Data analysis,test 65
Dive Into Python - Mark Pilgrim,8,HTML Processing,Scenario,Others/Generic,Generic,test 66
Dive Into Python - Mark Pilgrim,9,XML Processing,Scenario,Others/Generic,Generic,test 67
Dive Into Python - Mark Pilgrim,11,HTTP Web Services,Scenario,API,Generic,test 68
Dive Into Python - Mark Pilgrim,12,SOAP Web Services,Scenario,Others/Generic,Generic,test 69
Django 1.0 Template Development,2,"Views, URLs, and Generic Views",Scenario,Others/Generic,Web development,test 70
Django 1.0 Template Development,8,Pagination,Scenario,Others/Generic,Web development,test 71
Django 1.0 Template Development,10,Caching Your Pages,Scenario,Others/Generic,Web development,test 72
Django by Example,1,Building a Blog Application,Scenario,Others/Generic,Web development,test 73
Django by Example,2,Enhancing Your Blog with Advanced Features,Scenario,Others/Generic,Web development,test 74
Django by Example,3,Extending Your Blog Application,Scenario,Data and Processing,Web development,test 75
Django by Example,4,Building a Social Website,Scenario,Data and Processing,Web development,test 76
Django by Example,5,Sharing Content in Your Website,Scenario,Others/Generic,Web development,test 77
Django by Example,6,Tracking User Actions,Scenario,Data and Processing,Web development,test 78
Django by Example,7,Building an Online Shop,Scenario,Others/Generic,Web development,test 79
Django by Example,8,Managing Payments and Orders,Scenario,Data and Processing,Web development,test 80
Django by Example,9,Extending Your Shop,Scenario,Others/Generic,Web development,test 81
Django by Example,10,Building an e-Learning Platform,Scenario,Others/Generic,Web development,test 82
Django by Example,11,Caching Content,Scenario,Others/Generic,Web development,test 83
Django by Example,12,Building an API,Scenario,Others/Generic,Web development,test 84
Django Design Patterns and Best Practices,1,Django and Patterns,Scenario,API,Web development,test 85
Django Design Patterns and Best Practices,4,Views and URLs,Scenario,Data and Processing,Web development,test 86
Django Design Patterns and Best Practices,6,Admin Interface,Scenario,API,Web development,test 87
Django Design Patterns and Best Practices,8,Dealing with Legacy Code,Scenario,GUI,Web development,test 88
Django Design Patterns and Best Practices,9,Testing and Debugging,Scenario,Others/Generic,Web development,test 89
Django Design Patterns and Best Practices,10,Security,Scenario,Data and Processing,Web development,test 90
Django Design Patterns and Best Practices,11,Production-ready,Scenario,Others/Generic,Web development,test 91
Effective Python_ 59 Specific W - Brett Slatkin,1,Pythonic Thinking,Scenario,Data and Processing,Generic,test 92
Effective Python_ 59 Specific W - Brett Slatkin,6,Built-in Modules,Scenario,Data and Processing,Generic,test 93
"Expert Python Programming, 2nd Edition",9,Documenting Your Project,Scenario,Data and Processing,Generic,test 94
"Expert Python Programming, 2nd Edition",13,Concurrency,Scenario,Others/Generic,Generic,test 95
"Expert Python Programming, 2nd Edition",14,Useful Design Patterns,Scenario,API,Generic,test 96
Fluent Python,1,The Python Data Model,Scenario,API,Generic,test 97
Fluent Python,4,Text versus bytes,Scenario,Others/Generic,Generic,test 98
Fluent Python,11,Interfaces: from protocals to ABCs,Scenario,Others/Generic,Generic,test 99
Fluent Python,16,Coroutines,Scenario,Others/Generic,Generic,test 100
Fluent Python,17,Concurrency with futures,Scenario,Others/Generic,Generic,test 101
Fluent Python,18,Concurrency with asyncio,Scenario,API,Generic,test 102
Foundations of Agile Python Development,2,The IDE: Eclipsing the Command Line,Scenario,Others/Generic,Software development,test 103
Foundations of Agile Python Development,9,Databases,Scenario,Others/Generic,Software development,test 104
From Future Import Python,5,Python Distributions,Scenario,API,Generic,test 105
Hadoop with Python,2,MapReduce with Python,Scenario,Data and Processing,Data analysis,test 106
Hadoop with Python,4,Spark with Python,Scenario,API,Data analysis,test 107
Head First Python,5,Comprehending Data: Work That Data!,Scenario,Others/Generic,Generic,test 108
Head First Python,6,Custom Data Objects: Bundling Code with Data,Scenario,Others/Generic,Generic,test 109
Head First Python,7,Web Development: Putting It All Together,Scenario,GUI,Generic,test 110
Head First Python,8,Mobile App Development: Small Devices,Scenario,Data and Processing,Generic,test 111
Head First Python,9,Manage Your Data: Heading Input,Scenario,Others/Generic,Generic,test 112
Head First Python,10,Scaling Your Webapp: Getting Real,Scenario,Others/Generic,Generic,test 113
Head First Python,11,Dealing with Complexity: Data Wrangling,Scenario,Data and Processing,Generic,test 114
Internet of Things with Python,1,Understanding and Setting up the Base IoT Hardware,Scenario,Others/Generic,DevOps,test 115
Internet of Things with Python,2,Working with Python on Intel Galilgo Gen 2,Scenario,Data and Processing,DevOps,test 116
